{
  "uacp_vault_envelope": "1.0.0",
  "envelope_id": "8c3d4e5f-6071-8293-a4b5-c6d7e8f9a0b1",
  "created_at": "2026-08-10T09:30:00.000Z",
  "key_wrap": {
    "algorithm": "x25519-sealedbox",
    "recipients": [
      { "recipient_id": "c3e4f5a6b7c8d9e0", "wrapped_key": "YW5vdGhlci1ub3QtcmVhbC13cmFwcGVkLWtleS1zaW5nbGU" }
    ]
  },
  "content_cipher": { "algorithm": "xchacha20-poly1305-secretstream" },
  "bundles": [
    { "id": "9d4e5f60-7182-93a4-b5c6-d7e8f9a0b1c2", "ciphertext": "bm90LWEtcmVhbC1jaXBoZXJ0ZXh0LWZvci1hLXNpbmdsZS1idW5kbGU" }
  ],
  "companion_payloads": [
    { "id": "ae5f6071-8293-a4b5-c6d7-e8f9a0b1c2d3", "label": "retrieval-index", "ciphertext": "bm90LWEtcmVhbC1jaXBoZXJ0ZXh0LWZvci1hbi1pbmRleC1ibG9i" }
  ]
}
