{
  "uacp_vault_envelope": "1.0.0",
  "envelope_id": "3f9c4b2a-1e6d-4a2f-9c3b-7d8e5f6a1b2c",
  "created_at": "2026-08-10T12:00:00.000Z",
  "key_wrap": {
    "algorithm": "x25519-sealedbox",
    "recipients": [
      { "recipient_id": "a1c2e3f4a5b6c7d8", "wrapped_key": "dGhpcy1pcy1ub3QtYS1yZWFsLXdyYXBwZWQta2V5LWFsaWNl" },
      { "recipient_id": "b2d3f4a5b6c7d8e9", "wrapped_key": "dGhpcy1pcy1ub3QtYS1yZWFsLXdyYXBwZWQta2V5LWJvYg" }
    ]
  },
  "content_cipher": { "algorithm": "xchacha20-poly1305-secretstream" },
  "bundles": [
    { "id": "6a1b2c3d-4e5f-6071-8293-a4b5c6d7e8f9", "ciphertext": "bm90LWEtcmVhbC1jaXBoZXJ0ZXh0LWZvci1idW5kbGUtb25l" },
    { "id": "7b2c3d4e-5f60-7182-93a4-b5c6d7e8f9a0", "ciphertext": "bm90LWEtcmVhbC1jaXBoZXJ0ZXh0LWZvci1idW5kbGUtdHdv" }
  ]
}
